;;DigitalGrowth S.L.;;;;672 20 49 97;https://www.agenciamarketingdigitalgrowth.com/;;C. Gaspar Mendez, 21, 06011 Badajoz, Spain;
;;Agencia FISHER | Agencia de Diseño y Comunicación;;;;924 98 15 08;https://agenciafisher.es/;;Av. Jose María Alcaraz y Alenda, 47, 4ºD, 06011 Badajoz, Spain;
;;4P Marketing;;;;924 10 31 11;http://www.4pmarketing.es/;;PCTEX Despacho 26B, Av. de la Investigación, S/N, 06006 Badajoz, Spain;
;;Alzabrand [ Diseño de Marca y Comunicación];;;;688 90 46 26;http://www.alzabrand.com/;;Av. de la Investigación, 06006 Badajoz, Spain;
;;Lucía y el SEO;;;;657 08 99 38;https://luciayelseo.com/;;Cardenal Cisneros, 49, 4a, 06007 Badajoz, Spain;
;;IDEARIO MARKETING;;;;637 82 19 73;https://www.ideariomarketing.es/;;Fernando Pinna Casas, 1, 06010 Badajoz, Spain;
;;PYMES HACKS | Agencia de Marketing Digital;;;;611 83 39 11;https://pymeshacks.com/agencia-marketing-digital-badajoz/?utm_source=google+&utm_medium=maps&utm_campaign=google_my_business;;Av. Jose María Alcaraz y Alenda, 8, 06011 Badajoz, Spain;
;;errequeerrestudio y agencia redoble;;;;undefined;https://www.errequeerrestudio.com/;;C. Agustina de Aragón, 18, 4B, 06004 Badajoz, Spain;
;;Mkcero Agencia de Marketing Digital;;;;611 57 70 19;https://mkcero.com/;;C. Dolores Rodriguez Sopeña, 3, 06010 Badajoz, Spain;
;;Signum comunicación ️;;;;666 56 77 30;https://www.signumcomunicacion.com/diseno-web-badajoz/;;· Edificio S-XXI, P.º Fluvial, nº 15, 06011 Badajoz, Spain;
;;Nandroid SEO;;;;744 40 98 59;https://www.nandroidseo.com/;;C. Juan Antonio Cansino Rioboo, 5, p1, Entreplanta 14, 06001 Badajoz, Spain;
;;Agencia Visual;;;;924 10 21 31;http://www.agenciavisual.es/;;Pl. Caldas da Rainha, 6, 06011 Badajoz, Spain;
;;Tu Web de Cero Diseño Web y Posicionamiento SEO;;;;691 15 44 22;https://tuwebdecero.com/diseno-web-badajoz/;;C. Enrique Segura Otaño, 13, 06004 Badajoz, Spain;
;;DIMENTIA – Contemporary Creative Agency;;;;617 77 41 13;http://www.agencia.dimentia.es/;;C. Arco Agüero, 40, 06002 Badajoz, Spain;
;;Invéntate;;;;644 74 88 05;http://www.inventate.es/;;Av. de Cristobal Colón, 6, PLANTA 3, 06005 Badajoz, Spain;
;;Luis Revuelto Consultoría Web;;;;635 06 43 69;https://www.luisrevuelto.es/;;Avenida de la Investigación, s/n (Edificio PCTEX), 06006 Badajoz, Spain;
;;MonoGráfica [Agencia de Marketing y Publicidad];;;;924 25 48 03;http://www.monografica.es/;;Av. Ricardo Carapeto Zambrano, 130, 06008 Badajoz, Spain;
;;Marketing Digital Badajoz;;;;685 85 23 32;https://marketingdigitalpublicidad.es/;;Av. Juan Pereda Pila, 4, 1ºd, 06010 Badajoz, Spain;
;;Comboz | Agencia de Comunicación y Marketing;;;;647 90 78 78;http://www.comboz.es/;;Edificio EURODOM, C. Luis Álvarez Lencero, 3, Planta 4, Oficina 7, 06011 Badajoz, Spain;
;;SEO Badajoz Diseño Web y Posicionamiento;;;;652 81 95 98;https://seobadajoz.es/;;C. Antonio Martínez Virel, 1, 4ºC, 06011 Badajoz, Spain;
